title,links,first_paragraph
"As Coronavirus Spreads, Poison Hotlines See Rise in Accidents With Cleaning Products",https://www.nytimes.com/2020/04/21/health/coronavirus-poison-hotlines-rise-in-accidents-disinfectants.html?searchResultPosition=348,"As awareness of the coronavirus pandemic has spread throughout the United States, doctors who monitor activity at poison call centers have noticed an alarming trend: a significant increase in accidental exposures to household cleaners and disinfectants."
F.D.A. Authorizes First In-Home Test for Coronavirus,https://www.nytimes.com/2020/04/21/health/fda-in-home-test-coronavirus.html?searchResultPosition=349,"The Food and Drug Administration on Tuesday said it had granted emergency clearance to the first in-home test for the coronavirus, a nasal swab kit that will be sold by LabCorp."
"How Coronavirus Infected Some, but Not All, in a Restaurant",https://www.nytimes.com/2020/04/20/health/airflow-coronavirus-restaurants.html?searchResultPosition=350,"In January, at a restaurant in Guangzhou, China, one diner infected with the novel coronavirus but not yet feeling sick appeared to have spread the disease to nine other people. One of the restaurant’s air-conditioners apparently blew the virus particles around the dining room."
"Nearly All Patients Hospitalized With Covid-19 Had Chronic Health Issues, Study Finds",https://www.nytimes.com/2020/04/23/health/coronavirus-patients-risk.html?searchResultPosition=351,88 percent
Vaccine Rates Drop Dangerously as Parents Avoid Doctor’s Visits,https://www.nytimes.com/2020/04/23/health/coronavirus-measles-vaccines.html?searchResultPosition=352,"As parents around the country cancel well-child checkups to avoid coronavirus exposure, public health experts fear they are inadvertently sowing the seeds of another health crisis. Immunizations are dropping at a dangerous rate, putting millions of children at risk for measles, whooping cough and other life-threatening illnesses."
The Fear of Coronavirus and Flu Colliding in the Fall,https://www.nytimes.com/2020/04/22/health/coronavirus-flu-season-deaths.html?searchResultPosition=353,"Could the United States face two epidemics at the same time next fall, flu and the coronavirus?"
Two Cats Are First U.S. Pets to Test Positive for Coronavirus,https://www.nytimes.com/2020/04/22/health/cats-pets-coronavirus.html?searchResultPosition=354,"The first pets in the United States, two cats from New York State, have tested positive for the virus that is causing the worldwide pandemic, the Agriculture Department and the Centers for Disease Control announced Wednesday."
New U.S. Treatment Guidelines for Covid-19 Don’t See Much Progress,https://www.nytimes.com/2020/04/21/health/nih-covid-19-treatment.html?searchResultPosition=355,"The federal agency led by Dr. Anthony Fauci issued guidelines on Tuesday that stated there is no proven drug for treating coronavirus patients, a finding that essentially reinforces Dr. Fauci’s dissent from President Trump’s repeated promotion of certain drugs without evidence to support their use."
"Coronavirus Infections May Not Be Uncommon, Tests Suggest",https://www.nytimes.com/2020/04/21/health/coronavirus-antibodies-california.html?searchResultPosition=356,Two new studies using antibody tests to assess how many people have been infected with the coronavirus have turned up numbers higher than some experts had expected.
Christian Health Sharing Group Is Target of Customer Lawsuits,https://www.nytimes.com/2020/04/21/health/christian-ministries-insurance-lawsuits.html?searchResultPosition=357,A major Christian group is being sued by former customers in at least three states who claim it sold them an alternative to health insurance that misled them about protections against large medical bills.
"As Coronavirus Spreads, Poison Hotlines See Rise in Accidents With Cleaning Products",https://www.nytimes.com/2020/04/21/health/coronavirus-poison-hotlines-rise-in-accidents-disinfectants.html?searchResultPosition=358,"As awareness of the coronavirus pandemic has spread throughout the United States, doctors who monitor activity at poison call centers have noticed an alarming trend: a significant increase in accidental exposures to household cleaners and disinfectants."
F.D.A. Authorizes First In-Home Test for Coronavirus,https://www.nytimes.com/2020/04/21/health/fda-in-home-test-coronavirus.html?searchResultPosition=359,"The Food and Drug Administration on Tuesday said it had granted emergency clearance to the first in-home test for the coronavirus, a nasal swab kit that will be sold by LabCorp."
"How Coronavirus Infected Some, but Not All, in a Restaurant",https://www.nytimes.com/2020/04/20/health/airflow-coronavirus-restaurants.html?searchResultPosition=360,"In January, at a restaurant in Guangzhou, China, one diner infected with the novel coronavirus but not yet feeling sick appeared to have spread the disease to nine other people. One of the restaurant’s air-conditioners apparently blew the virus particles around the dining room."
"The Pandemic’s Hidden Victims: Sick or Dying, but Not From the Virus",https://www.nytimes.com/2020/04/20/health/treatment-delays-coronavirus.html?searchResultPosition=361,"Maria Kefalas considers her husband, Patrick Carr, a forgotten victim of the coronavirus."
"C.D.C. Labs Were Contaminated, Delaying Coronavirus Testing, Officials Say",https://www.nytimes.com/2020/04/18/health/cdc-coronavirus-lab-contamination-testing.html?searchResultPosition=362,"Sloppy laboratory practices at the Centers for Disease Control and Prevention caused contamination that rendered the nation’s first coronavirus tests ineffective, federal officials confirmed on Saturday."
"An Overlooked, Possibly Fatal Coronavirus Crisis: A Dire Need for Kidney Dialysis",https://www.nytimes.com/2020/04/18/health/kidney-dialysis-coronavirus.html?searchResultPosition=363,"For weeks, U.S. government officials and hospital executives have warned of a looming shortage of ventilators as the coronavirus pandemic descended."
The Coronavirus in America: The Year Ahead,https://www.nytimes.com/2020/04/18/health/coronavirus-america-future.html?searchResultPosition=364,"The coronavirus is spreading from America’s biggest cities to its suburbs, and has begun encroaching on the nation’s rural regions. The virus is believed to have infected millions of citizens and has killed more than 34,000."
Are Face Masks the New Condoms?,https://www.nytimes.com/2020/04/18/health/coronavirus-mask-condom.html?searchResultPosition=365,"ubiquitous, sometimes fashionable, promoted with public service announcements? They should be, one virus researcher says, if early indications are correct in suggesting that Covid-19 is often spread by people who feel healthy and show no symptoms."
Fears of Ventilator Shortage Unleash a Wave of Innovations,https://www.nytimes.com/2020/04/17/health/ventilators-coronavirus.html?searchResultPosition=366,"As the coronavirus rages across the globe, ventilators that pump oxygen into the lungs of critically ill patients have been embraced as the best hope for saving lives."
Trump Calls This Drug a ‘Game Changer.’ Doctors Aren’t So Sure.,https://www.nytimes.com/2020/04/17/health/trump-hydroxychloroquine-coronavirus.html?searchResultPosition=367,"Just a month ago, Dr. Bushra Mina had no playbook to treat patients who were arriving with coronavirus at Lenox Hill Hospital in Manhattan."
We All Live in Bubbles Now. How Safe Is Yours?,https://www.nytimes.com/2020/04/17/health/cheating-on-an-isolation-bubble-coronavirus.html?searchResultPosition=368,"The problem was not the girlfriend, the singer, the drummer and the guitarist told their recording engineer. They liked his girlfriend. They trusted his girlfriend. It was her four roommates and their friends and their lovers. Who were they seeing? What were they touching?"
When Coronavirus Care Gets Lost in Translation,https://www.nytimes.com/2020/04/17/health/covid-coronavirus-medical-translators.html?searchResultPosition=369,"Recently Dr. Alister Martin faced his patient, a Hispanic man who spoke no English, and broke the news that he would have to be intubated. Struggling to keep his voice calm, Dr. Martin, of Massachusetts General Hospital in Boston, suggested that the man call his wife. And he told the patient, a bus driver and a father of three, that he should give her his love and say goodbye, just in case."
Doctors Press F.D.A. to Let More Gay Men Donate Blood,https://www.nytimes.com/2020/04/16/health/us-blood-donation-rules-gay-men.html?searchResultPosition=370,"More than 500 doctors, researchers and public health specialists are calling on the Food and Drug Administration to eliminate constraints on blood donations by gay and bisexual men, saying the agency did not go far enough when it relaxed its restrictions earlier this month."
"The Pandemic’s Hidden Victims: Sick or Dying, but Not From the Virus",https://www.nytimes.com/2020/04/20/health/treatment-delays-coronavirus.html?searchResultPosition=371,"Maria Kefalas considers her husband, Patrick Carr, a forgotten victim of the coronavirus."
"C.D.C. Labs Were Contaminated, Delaying Coronavirus Testing, Officials Say",https://www.nytimes.com/2020/04/18/health/cdc-coronavirus-lab-contamination-testing.html?searchResultPosition=372,"Sloppy laboratory practices at the Centers for Disease Control and Prevention caused contamination that rendered the nation’s first coronavirus tests ineffective, federal officials confirmed on Saturday."
"An Overlooked, Possibly Fatal Coronavirus Crisis: A Dire Need for Kidney Dialysis",https://www.nytimes.com/2020/04/18/health/kidney-dialysis-coronavirus.html?searchResultPosition=373,"For weeks, U.S. government officials and hospital executives have warned of a looming shortage of ventilators as the coronavirus pandemic descended."
The Coronavirus in America: The Year Ahead,https://www.nytimes.com/2020/04/18/health/coronavirus-america-future.html?searchResultPosition=374,"The coronavirus is spreading from America’s biggest cities to its suburbs, and has begun encroaching on the nation’s rural regions. The virus is believed to have infected millions of citizens and has killed more than 34,000."
Are Face Masks the New Condoms?,https://www.nytimes.com/2020/04/18/health/coronavirus-mask-condom.html?searchResultPosition=375,"ubiquitous, sometimes fashionable, promoted with public service announcements? They should be, one virus researcher says, if early indications are correct in suggesting that Covid-19 is often spread by people who feel healthy and show no symptoms."
Fears of Ventilator Shortage Unleash a Wave of Innovations,https://www.nytimes.com/2020/04/17/health/ventilators-coronavirus.html?searchResultPosition=376,"As the coronavirus rages across the globe, ventilators that pump oxygen into the lungs of critically ill patients have been embraced as the best hope for saving lives."
Trump Calls This Drug a ‘Game Changer.’ Doctors Aren’t So Sure.,https://www.nytimes.com/2020/04/17/health/trump-hydroxychloroquine-coronavirus.html?searchResultPosition=377,"Just a month ago, Dr. Bushra Mina had no playbook to treat patients who were arriving with coronavirus at Lenox Hill Hospital in Manhattan."
We All Live in Bubbles Now. How Safe Is Yours?,https://www.nytimes.com/2020/04/17/health/cheating-on-an-isolation-bubble-coronavirus.html?searchResultPosition=378,"The problem was not the girlfriend, the singer, the drummer and the guitarist told their recording engineer. They liked his girlfriend. They trusted his girlfriend. It was her four roommates and their friends and their lovers. Who were they seeing? What were they touching?"
When Coronavirus Care Gets Lost in Translation,https://www.nytimes.com/2020/04/17/health/covid-coronavirus-medical-translators.html?searchResultPosition=379,"Recently Dr. Alister Martin faced his patient, a Hispanic man who spoke no English, and broke the news that he would have to be intubated. Struggling to keep his voice calm, Dr. Martin, of Massachusetts General Hospital in Boston, suggested that the man call his wife. And he told the patient, a bus driver and a father of three, that he should give her his love and say goodbye, just in case."
Doctors Press F.D.A. to Let More Gay Men Donate Blood,https://www.nytimes.com/2020/04/16/health/us-blood-donation-rules-gay-men.html?searchResultPosition=380,"More than 500 doctors, researchers and public health specialists are calling on the Food and Drug Administration to eliminate constraints on blood donations by gay and bisexual men, saying the agency did not go far enough when it relaxed its restrictions earlier this month."
"Disposable N95 Masks Can Be Decontaminated, Researchers Confirm",https://www.nytimes.com/2020/04/16/health/n95-masks-decontaminated-coronavirus.html?searchResultPosition=381,"Researchers have confirmed that there are several effective methods for decontaminating the N95 masks worn by health professionals so that they can be used more than once, the National Institutes of Health announced Wednesday."
"Obesity Linked to Severe Coronavirus Disease, Especially for Younger Patients",https://www.nytimes.com/2020/04/16/health/coronavirus-obesity-higher-risk.html?searchResultPosition=382,"Obesity may be one of the most important predictors of severe coronavirus illness, new studies say. It’s an alarming finding for the United States, which has one of the highest obesity rates in the world."
A Tiny Hospital Struggles to Treat a Burst of Coronavirus Patients,https://www.nytimes.com/2020/04/16/health/coronavirus-rural-hospitals.html?searchResultPosition=383,"Dr. Desmond Wah is used to being the only physician tending to patients during his shifts at Margaret Mary Community Hospital in Batesville, Ind., population 6,500, where at least half of the 25 beds are usually empty. But he was hardly prepared for the weeklong shift he started on March 20, when the two counties Batesville straddles became one of rural America’s worst coronavirus hot spots."
"Asthma Is Absent Among Top Covid-19 Risk Factors, Early Data Shows",https://www.nytimes.com/2020/04/16/health/coronavirus-asthma-risk.html?searchResultPosition=384,"For people with asthma, the outbreak of a pandemic that can lead to respiratory failure has not been a welcome event. Many health organizations have cautioned that asthmatics are most likely at higher risk for severe illness if they get the coronavirus. There’s been a run on inhalers, and coronavirus patients like the actor Idris Elba have openly worried about their asthma."
"W.H.O., Now Trump’s Scapegoat, Warned About Coronavirus Early and Often",https://www.nytimes.com/2020/04/16/health/WHO-Trump-coronavirus.html?searchResultPosition=385,"On Jan. 22, two days after Chinese officials first publicized the serious threat posed by the new virus ravaging the city of Wuhan, the chief of the World Health Organization held the first of what would be months of almost daily media briefings, sounding the alarm, telling the world to take the outbreak seriously."
"UnitedHealth Reports Profit, Citing Falling Demand for Elective Care",https://www.nytimes.com/2020/04/15/health/unitedhealth-profit-coronavirus.html?searchResultPosition=386,"UnitedHealth Group, one of the nation’s major insurers, reported on Wednesday that its earnings actually increased this past quarter, adding that the costs of the coronavirus pandemic were offset by the cancellations of routine medical appointments and elective surgeries for hip replacements and other conditions."
"What the W.H.O. Does, and How U.S. Funding Cuts Could Affect It",https://www.nytimes.com/2020/04/15/health/who-world-health-organization-coronavirus.html?searchResultPosition=387,"President Trump’s decision to halt funding for the World Health Organization, depriving it of its biggest funding source, could have far-reaching effects in efforts to fight diseases and make health care more widely available across the globe."
"C.D.C. Says More Than 9,000 Health Care Workers Have Contracted Coronavirus",https://www.nytimes.com/2020/04/14/health/coronavirus-health-care-workers.html?searchResultPosition=388,"The Centers for Disease Control and Prevention reported on Tuesday that 9,282 health care professionals had contracted the coronavirus in the United States as of April 9 and that 27 had died from it."
Does Widespread Disinfecting Kill the Coronavirus? It’s Under Debate,https://www.nytimes.com/2020/04/14/health/disinfectant-coronavirus.html?searchResultPosition=389,"The images are compelling: Fire trucks in Tehran or Manila spray the streets. Amazon tests a disinfectant fog inside a warehouse, hoping to calm workers’ fears and get them back on the job. TV commercials show health care workers cleaning chairs where blood donors sat. Families nervously wipe their mail and newly delivered groceries."
"Stay 6 Feet Apart, We’re Told. But How Far Can Air Carry Coronavirus?",https://www.nytimes.com/2020/04/14/health/coronavirus-six-feet.html?searchResultPosition=390,"The rule of thumb, or rather feet, has been to stand six feet apart in public. That’s supposed to be a safe distance if a person nearby is coughing or sneezing and is infected with the novel coronavirus, spreading droplets that may carry virus particles."
"Disposable N95 Masks Can Be Decontaminated, Researchers Confirm",https://www.nytimes.com/2020/04/16/health/n95-masks-decontaminated-coronavirus.html?searchResultPosition=391,"Researchers have confirmed that there are several effective methods for decontaminating the N95 masks worn by health professionals so that they can be used more than once, the National Institutes of Health announced Wednesday."
"Obesity Linked to Severe Coronavirus Disease, Especially for Younger Patients",https://www.nytimes.com/2020/04/16/health/coronavirus-obesity-higher-risk.html?searchResultPosition=392,"Obesity may be one of the most important predictors of severe coronavirus illness, new studies say. It’s an alarming finding for the United States, which has one of the highest obesity rates in the world."
A Tiny Hospital Struggles to Treat a Burst of Coronavirus Patients,https://www.nytimes.com/2020/04/16/health/coronavirus-rural-hospitals.html?searchResultPosition=393,"Dr. Desmond Wah is used to being the only physician tending to patients during his shifts at Margaret Mary Community Hospital in Batesville, Ind., population 6,500, where at least half of the 25 beds are usually empty. But he was hardly prepared for the weeklong shift he started on March 20, when the two counties Batesville straddles became one of rural America’s worst coronavirus hot spots."
"Asthma Is Absent Among Top Covid-19 Risk Factors, Early Data Shows",https://www.nytimes.com/2020/04/16/health/coronavirus-asthma-risk.html?searchResultPosition=394,"For people with asthma, the outbreak of a pandemic that can lead to respiratory failure has not been a welcome event. Many health organizations have cautioned that asthmatics are most likely at higher risk for severe illness if they get the coronavirus. There’s been a run on inhalers, and coronavirus patients like the actor Idris Elba have openly worried about their asthma."
"W.H.O., Now Trump’s Scapegoat, Warned About Coronavirus Early and Often",https://www.nytimes.com/2020/04/16/health/WHO-Trump-coronavirus.html?searchResultPosition=395,"On Jan. 22, two days after Chinese officials first publicized the serious threat posed by the new virus ravaging the city of Wuhan, the chief of the World Health Organization held the first of what would be months of almost daily media briefings, sounding the alarm, telling the world to take the outbreak seriously."
"UnitedHealth Reports Profit, Citing Falling Demand for Elective Care",https://www.nytimes.com/2020/04/15/health/unitedhealth-profit-coronavirus.html?searchResultPosition=396,"UnitedHealth Group, one of the nation’s major insurers, reported on Wednesday that its earnings actually increased this past quarter, adding that the costs of the coronavirus pandemic were offset by the cancellations of routine medical appointments and elective surgeries for hip replacements and other conditions."
"What the W.H.O. Does, and How U.S. Funding Cuts Could Affect It",https://www.nytimes.com/2020/04/15/health/who-world-health-organization-coronavirus.html?searchResultPosition=397,"President Trump’s decision to halt funding for the World Health Organization, depriving it of its biggest funding source, could have far-reaching effects in efforts to fight diseases and make health care more widely available across the globe."
"C.D.C. Says More Than 9,000 Health Care Workers Have Contracted Coronavirus",https://www.nytimes.com/2020/04/14/health/coronavirus-health-care-workers.html?searchResultPosition=398,"The Centers for Disease Control and Prevention reported on Tuesday that 9,282 health care professionals had contracted the coronavirus in the United States as of April 9 and that 27 had died from it."
Does Widespread Disinfecting Kill the Coronavirus? It’s Under Debate,https://www.nytimes.com/2020/04/14/health/disinfectant-coronavirus.html?searchResultPosition=399,"The images are compelling: Fire trucks in Tehran or Manila spray the streets. Amazon tests a disinfectant fog inside a warehouse, hoping to calm workers’ fears and get them back on the job. TV commercials show health care workers cleaning chairs where blood donors sat. Families nervously wipe their mail and newly delivered groceries."
"Stay 6 Feet Apart, We’re Told. But How Far Can Air Carry Coronavirus?",https://www.nytimes.com/2020/04/14/health/coronavirus-six-feet.html?searchResultPosition=400,"The rule of thumb, or rather feet, has been to stand six feet apart in public. That’s supposed to be a safe distance if a person nearby is coughing or sneezing and is infected with the novel coronavirus, spreading droplets that may carry virus particles."
Millions of Children Are at Risk for Measles as Coronavirus Fears Halt Vaccines,https://www.nytimes.com/2020/04/13/health/coronavirus-measles-vaccines.html?searchResultPosition=401,"More than 100 million children could be at risk for measles because countries around the world are suspending national immunization programs in order to reduce the risk of coronavirus infection, international public health leaders warned on Monday."
"Despite Qualms, Arthritis Drug Is to Be Tested in Coronavirus Study",https://www.nytimes.com/2020/04/13/health/coronavirus-arthritis-drug-baricitinib.html?searchResultPosition=402,An Eli Lilly drug for rheumatoid arthritis carries a warning on its label saying patients with infections should not take it because it can make infections worse. Yet the National Institutes of Health is about to test it in people hospitalized with coronavirus infections.
Food Workers Say C.D.C. Guidelines Put Them at Greater Risk for Infection,https://www.nytimes.com/2020/04/13/health/workers-protections-coronavirus.html?searchResultPosition=403,"Lisa Harris, a cashier at a Kroger grocery store in Virginia, was surprised last week when a customer offered her a $5 bill as a tip. Ms. Harris, a Kroger employee for 13 years, cited store policy in declining the generous offer."
Just What Older People Didn’t Need: More Isolation,https://www.nytimes.com/2020/04/13/health/coronavirus-elderly-isolation-loneliness.html?searchResultPosition=404,"At midmorning, Lisa Carfagna, a marketing staffer for the 92nd Street Y in Manhattan, took a brief break from working at home on Long Island and called the Rubins on the Upper East Side."
Small Chloroquine Study Halted Over Risk of Fatal Heart Complications,https://www.nytimes.com/2020/04/12/health/chloroquine-coronavirus-trump.html?searchResultPosition=405,A small study in Brazil was halted early for safety reasons after coronavirus patients taking a higher dose of chloroquine developed irregular heart rates that increased their risk of a potentially fatal heart arrhythmia.
Why Are Some People So Much More Infectious Than Others?,https://www.nytimes.com/2020/04/12/health/coronavirus-superspreader-why-infectious.html?searchResultPosition=406,"As the coronavirus tears through the country, scientists are asking: Are some people more infectious than others? Are there superspreaders, people who seem to just spew out virus, making them especially likely to infect others?"
Dialysis Patients Face Close-Up Risk From Coronavirus,https://www.nytimes.com/2020/04/11/health/dialysis-risk-coronavirus.html?searchResultPosition=407,"Mat Risher leaves the safety of his home near Seattle three days a week for dialysis at a clinic, a treatment he cannot live without but one that now most likely increases his risk of exposure to the coronavirus."
Hospital Chaplains Try to Keep the Faith During the Coronavirus Pandemic,https://www.nytimes.com/2020/04/11/health/coronavirus-chaplains-hospitals.html?searchResultPosition=408,"The Rev. Leah Klug isn’t a stickler on religious rituals. As a hospital chaplain for Swedish Medical Group in the Seattle area, she makes do with the supplies she can find. Recently, she performed an anointing of the sick with mouthwash, because she didn’t have any oil on hand. She is accustomed to seeking the sacred in sterile rooms, reading psalms above the steady beep of a heart monitor."
Will an Antibody Test Allow Us to Go Back to School or Work?,https://www.nytimes.com/2020/04/10/health/coronavirus-antibody-test.html?searchResultPosition=409,"When will life return to normal, or at least a new normal?"
How to Quit Smoking and Vaping During the Coronavirus Pandemic,https://www.nytimes.com/2020/04/09/health/coronavirus-smoking-vaping-quit.html?searchResultPosition=410,or at least slow down.
