title,links,first_paragraph
New Zealand Stamps Out the Virus. For a Second Time.,https://www.nytimes.com/2020/10/07/world/australia/new-zealand-coronavirus.html?searchResultPosition=2,"The first time New Zealand thought it had eliminated the coronavirus from its isolated shores, a mysterious outbreak in its largest city shattered any sense of victory over a tenacious foe."
‘It Really Was Abandonment’: Virus Crisis Grips British Universities,https://www.nytimes.com/2020/10/06/world/europe/virus-UK-universities.html?searchResultPosition=4,"Inside a dormitory now known by students as H.M.P., for Her Majesty’s Prison, trash piled up in shared kitchens. Students washed their clothes in bathroom sinks. Security guards stalked the gates, keeping anyone from leaving or entering."
The Pilgrimage Must Go On: Senegal Holds Festival That Could Draw Millions,https://www.nytimes.com/2020/10/06/world/africa/magal-touba-senegal-coronavirus.html?searchResultPosition=5,"All roads to the holy city of Touba were bumper-to-bumper. Buses packed with pilgrims inched along, their roofs piled high with foam mattresses. Tollbooth attendants smiled in greeting and held out ungloved hands for change, all day long."
Distrust of China Jumps to New Highs in Democratic Nations,https://www.nytimes.com/2020/10/06/world/asia/china-negative-pew-survey.html?searchResultPosition=6,"Xi Jinping celebrates China’s battle against the coronavirus as a success. But in the United States and other wealthy democracies, the pandemic has driven negative views of China to new heights, a survey published on Tuesday showed."
Maduro Wins Chance of New Ruling Over Billions in Gold Held in U.K.,https://www.nytimes.com/2020/10/06/world/europe/nicolas-maduro-venezuela-gold.html?searchResultPosition=7,A British court gave another chance to President Nicolás Maduro of Venezuela in a tug of war over about $2 billion of gold stored at the Bank of England in a contentious case that pivots on whom Britain recognizes as the South American country’s leader.
Pompeo’s Message in Japan: Countering China Is Worth Meeting Face to Face,https://www.nytimes.com/2020/10/06/world/asia/pompeo-japan.html?searchResultPosition=8,"For Japan, it was the first time its new prime minister hosted international emissaries. For the United States, it was the first trip to Asia by its top diplomat in more than a year."
Contact tracing efforts are restricted to the two days before Trump’s diagnosis.,https://www.nytimes.com/2020/10/06/world/contact-tracing-efforts-are-restricted-to-the-two-days-before-trumps-diagnosis.html?searchResultPosition=9,"Despite almost daily disclosures of new coronavirus infections among President Trump’s close associates, the White House is making little effort to investigate the scope and source of its outbreak."
"Quino, Creator of Beloved ‘Mafalda’ Cartoon, Dies at 88",https://www.nytimes.com/2020/10/05/world/americas/quino-dead.html?searchResultPosition=10,"Joaquín Salvador Lavado, the Argentine cartoonist known as Quino who created a comic strip about an irreverent girl named Mafalda whose unique view of daily life and politics made her beloved across Spanish-speaking countries, died on Sept. 30 at his home in Luján de Cuyo, Argentina. He was 88."
"In U.K.’s Test and Trace: Now You See ’em, Now You Don’t",https://www.nytimes.com/2020/10/05/world/europe/uk-testing-johnson-hancock.html?searchResultPosition=11,"Prime Minister Boris Johnson’s “world beating” test-and-trace program has been dogged by technical glitches, overburdened laboratories and poorly trained contact tracers. Now, add to that a data-entry error more likely to trip up an amateur bookkeeper than the public health service of the world’s sixth-largest economy."
"China Ramps Up a War of Words, Warning the U.S. of Its Red Lines",https://www.nytimes.com/2020/10/05/world/asia/china-propaganda-united-states.html?searchResultPosition=12,"The soldiers run through the forest, through the surf, through smoke and flames, ready to die for the motherland. The video, one of a series that has recently appeared online in China, climaxes with the launch of nine ballistic missiles and a fiery barrage of explosions."
"Indonesia’s Parliament Approves Jobs Bill, Despite Labor and Environmental Fears",https://www.nytimes.com/2020/10/05/world/asia/indonesia-stimulus-bill-strike.html?searchResultPosition=13,"Indonesia’s Parliament gave final approval Monday to a sweeping jobs-creation bill that would loosen labor and environmental regulations, moves that critics say would harm workers and permit widespread deforestation."
"Israel’s Coronavirus Lockdown Fuels Protests, Violence and Confusion",https://www.nytimes.com/2020/10/05/world/middleeast/israel-coronavirus-lockdown.html?searchResultPosition=14,"Fractured by internal political conflicts, confusing instructions and a lack of public trust in the government, Israel seems to be fraying further under a second national lockdown as the country struggles to cope with a surge in coronavirus cases and deaths that, relative to the size of the population, are among the worst in the world."
The Pressure to Be Perfect Turns Deadly for Celebrities in Japan,https://www.nytimes.com/2020/10/05/world/asia/japan-suicide-celebrities.html?searchResultPosition=15,"From the outside, Yuko Takeuchi seemed to have a golden life. She had won Japan’s top acting award three times and had recently given birth to her second child. A graceful beauty, she appeared in a box-office favorite last year and advertisements for a top ramen brand."
Paris will close its bars and many cafes for at least two weeks starting on Tuesday.,https://www.nytimes.com/2020/10/05/world/paris-will-close-its-bars-and-many-cafes-for-at-least-two-weeks-starting-on-tuesday.html?searchResultPosition=16,"Bars in Paris will close for two weeks starting on Tuesday, the authorities there announced on Monday, as France tries to stem a surge of coronavirus cases in its capital. The measure will also affect most cafes, which in many cases serve alcohol, but little or no food. Restaurants will be able to remain open if they follow a strict health protocol."
‘Keep Calm and Carry On’ May Not Work in a Time of Pandemic,https://www.nytimes.com/2020/10/04/world/europe/britain-london-coronavirus.html?searchResultPosition=17,"During a recent visit to a private London hospital, I was horrified to encounter a delivery man wheeling in a load of supplies without wearing a face mask. An orderly in blue scrubs stood inside the elevator, three feet from me, with his mask draped around his chin."
Pope Criticizes Lack of Unity in World’s Response to Coronavirus,https://www.nytimes.com/2020/10/04/world/europe/pope-francis-coronavirus-response.html?searchResultPosition=18,Pope Francis criticized the failures of global cooperation in response to the coronavirus pandemic in a document released on Sunday that underscores the priorities of his pontificate.
"President Trump, undergoing an experimental antiviral treatment, spends a third day in the hospital.",https://www.nytimes.com/2020/10/04/world/president-trump-undergoing-an-experimental-antiviral-treatment-spends-a-third-day-in-the-hospital.html?searchResultPosition=19,"President Trump entered his third day in the hospital on Sunday after contracting the coronavirus and falling ill last week, even as confusing and contradictory accounts about his medical condition added to the national sense of uncertainty and concern for the 74-year-old president’s well-being."
Mike Pompeo cuts visits to South Korea and Mongolia from his Asia trip.,https://www.nytimes.com/2020/10/04/world/mike-pompeo-cuts-visits-to-south-korea-and-mongolia-from-his-asia-trip.html?searchResultPosition=20,"As President Trump remains hospitalized with Covid-19, Secretary of State Mike Pompeo will cut short a trip to Asia this week, canceling stops in South Korea and Mongolia but continuing with a visit to Japan."
"Despite Crises, India Fixes Its Gaze on a Bollywood Tragedy",https://www.nytimes.com/2020/10/03/world/asia/india-bollywood-sushant-singh-rajput.html?searchResultPosition=22,"A rising young movie star meets a tragic end. His family blames his death on his glamorous girlfriend. As she sits in jail, her friends proclaiming her innocence, the police hint at a shadowy network of money laundering and illegal drugs deep within the world of show business."
Data shows fewer Afghan women than men get Covid-19. That’s bad news.,https://www.nytimes.com/2020/10/03/world/afghan-women-men.html?searchResultPosition=23,a discrepancy that experts say is most likely the result of women being shut out of the health care system and the public sphere.
"Chris Christie, who helped Trump prepare for the debate, has the virus.",https://www.nytimes.com/2020/10/03/world/chris-christie-who-helped-trump-prepare-for-the-debate-has-the-virus.html?searchResultPosition=24,"Chris Christie, the former governor of New Jersey who for several days this week helped the president prepare for the debate, said he has tested positive for the coronavirus."
"Contact Tracing, Key to Reining In the Virus, Falls Flat in the West",https://www.nytimes.com/2020/10/03/world/europe/covid-contract-tracing.html?searchResultPosition=25,"As the coronavirus stampeded across Europe and the United States this spring, governments made their depleted citizens a tantalizing promise: Soon, legions of disease detectives would hunt down anyone exposed to the virus, confining them to their homes and letting everyone else get on with their lives."
"India’s Covid-19 Death Toll Passes 100,000",https://www.nytimes.com/2020/10/03/world/asia/india-coronavirus-deaths.html?searchResultPosition=26,"More than 100,000 people in India have died from the coronavirus, the government said on Saturday, even as officials plan to lift more restrictions in hopes of reviving the crippled economy."
"Trump says he feels better, but his chief of staff says he is ‘still not on a clear path to a full recovery.’",https://www.nytimes.com/2020/10/03/world/trump-says-he-feels-better-but-his-chief-of-staff-says-he-is-still-not-on-a-clear-path-to-a-full-recovery.html?searchResultPosition=27,"President Trump’s vital signs were “very concerning” over the last day and he is not out of danger, the White House chief of staff said on Saturday, contradicting a rosier picture painted by the president’s doctors on television just minutes before."
Tight New Restrictions in Parts of Quebec as Cases Rise Again,https://www.nytimes.com/2020/10/02/world/canada/quebec-coronavirus-restrictions.html?searchResultPosition=28,"The arrival of autumn has brought along the predicted rebound of coronavirus infections, at least in Quebec and Ontario."
Australians Watching American Politics: ???!!!!***$%%#,https://www.nytimes.com/2020/10/02/world/australia/american-politics-trump-biden-coronavirus.html?searchResultPosition=29,"The Australia Letter is a weekly newsletter from our Australia bureau. Sign up to get it by email. This week’s issue is written by Damien Cave, the Australia bureau chief."
,https://www.nytimes.com/2020/10/02/world/02virus-briefing-deblasio.html?searchResultPosition=30,"With New York City watching to see if a recent uptick in coronavirus cases could trigger another wave of shutdowns and closings, Mayor Bill de Blasio said on Friday that the city’s seven-day average for positive test results had risen to 1.53 percent."
"World Reacts to Trump’s Diagnosis With Shock, Unease and Some Derision",https://www.nytimes.com/2020/10/02/world/europe/global-voices-trump-coronavirus-positive.html?searchResultPosition=41,Some pointed to the irony of it. Others offered well wishes. More than a few said it was just deserts.
"Trump Tests Positive for Coronavirus, and the World Shudders",https://www.nytimes.com/2020/10/02/world/reactions-trump-positive-covid-test.html?searchResultPosition=43,"President Trump’s disclosure that he had been infected by the coronavirus sent a shudder around the world on Friday, drawing sympathy from leaders who have grappled with the pandemic in their own countries and more pointed responses from critics who noted Mr. Trump’s cavalier handling of the threat."
Trump’s positive cause global markets to tumble.,https://www.nytimes.com/2020/10/02/world/trumps-positive-cause-global-markets-to-tumble.html?searchResultPosition=44,Global markets dropped early Friday after President Trump said that he and the first lady had tested positive for the coronavirus.
Trump and first lady test positive for the virus.,https://www.nytimes.com/2020/10/02/world/trump-and-first-lady-test-positive-for-the-virus.html?searchResultPosition=45,"President Trump said early Friday that he and his wife, Melania, had tested positive for the coronavirus, throwing the nation’s leadership into uncertainty and escalating the crisis posed by a pandemic that has already killed more than 207,000 Americans and devastated the economy."
"Covid-19 Upends South Korea’s Thanksgiving, and Its Rituals",https://www.nytimes.com/2020/10/02/world/asia/covid-south-korea-chuseok.html?searchResultPosition=46,"Once a year for the past three decades, the Joo brothers have traveled back to their hometown from South Korea’s capital to mark the Chuseok holiday."
Indonesia’s Stimulus Plan Draws Fire From Environmentalists and Unions,https://www.nytimes.com/2020/10/02/world/asia/indonesia-bill-environment-unions.html?searchResultPosition=47,Indonesia’s Parliament is on the verge of approving a sweeping coronavirus stimulus package that opponents charge would undermine worker protections and permit widespread destruction of the country’s rainforests.
A top Trump aide has tested positive for the virus.,https://www.nytimes.com/2020/10/01/world/a-top-trump-aide-has-tested-positive-for-the-virus.html?searchResultPosition=48,"One of President Trump’s most senior advisers has tested positive for the coronavirus, three people familiar with the matter said Thursday night."
"After 2 Years of Paralysis, Belgium Forms a (Very Fragile) Government",https://www.nytimes.com/2020/10/01/world/europe/belgium-government-coalition.html?searchResultPosition=49,"For nearly two years, Belgium has been without a formal government, leaving a country that was already divided by language and politics to endure a pandemic with lame-duck caretakers wielding emergency powers."
"On China’s National Day, Hong Kong Police Quash Protests",https://www.nytimes.com/2020/10/01/world/asia/hong-kong-protests-china.html?searchResultPosition=50,"One year ago, China’s National Day on Oct. 1 was a day of protest and turmoil in Hong Kong. Demonstrators set fires and blockaded streets. The police responded with tear gas and pepper spray. One officer shot a young demonstrator with a live bullet."
"Fans celebrate the Stanley Cup champions, well outside the N.H.L.’s pandemic bubble.",https://www.nytimes.com/2020/10/01/world/fans-celebrate-the-stanley-cup-champions-well-outside-the-nhls-pandemic-bubble.html?searchResultPosition=53,"The Tampa Bay Lightning won the National Hockey League’s top trophy on Monday from within the confines of a 24/7 pandemic bubble in western Canada, and without any fans in the arena to watch."
"The Carnival Parade Is Canceled, and Rio Is Reeling",https://www.nytimes.com/2020/09/30/world/americas/rio-carnival-postponed.html?searchResultPosition=55,"For more than a century, Rio de Janeiro’s carnival has been an irrepressible force, unstoppable by wars, disease, labor strikes or political repression."
"Woman Dies in Delhi After Gang Rape, Fueling Outrage Again in India",https://www.nytimes.com/2020/09/30/world/asia/india-rape-caste.html?searchResultPosition=56,"A teenager from a north Indian village who was dragged from a field and raped by a group of men died of her injuries at a hospital in New Delhi on Tuesday, triggering nationwide outrage again after years of what experts describe as a gang rape epidemic in India."
Russians Were Urged to Return to Normal Life. Except for Putin.,https://www.nytimes.com/2020/09/30/world/europe/putin-virus-russia-bubble.html?searchResultPosition=57,The officials from a secretive Russian security force seemed to know exactly what they wanted when they reached out to Olga Izranova’s company last spring.
"In Madrid, Covid-19 Resurgence Divides Rich and Poor",https://www.nytimes.com/2020/09/30/world/europe/covid-lockdown-madrid-spain.html?searchResultPosition=60,"Every weekday morning, Jorge Sánchez leaves home in Puente de Vallecas, one of the poorest and most densely populated areas of Madrid, and drives 10 miles to his job as a gardener tending a public park in an affluent district of the city."
"For Boris Johnson, a Grim Premiership That No One Foresaw",https://www.nytimes.com/2020/09/29/world/europe/boris-johnson-grim-premiership.html?searchResultPosition=62,"Prime Minister Boris Johnson likes to style himself as a buccaneer, waving a cutlass and thumbing his nose at convention as he leads Britain into an uncharted future. These days, however, he looks more like a latter-day Captain Bligh, grimly confronting one mutiny after another."
"Vilified Early Over Lax Virus Strategy, Sweden Seems to Have Scourge Controlled",https://www.nytimes.com/2020/09/29/world/europe/sweden-coronavirus-strategy.html?searchResultPosition=63,"The scene at Norrsken House Stockholm, a co-working space, oozed with radical normalcy: Young, turtleneck-wearing hipsters schmoozed in the coffee corner. Others chatted freely away, at times quite near each other, in cozy conference rooms. Face masks were nowhere to be seen."
"In France, Southerners Grumble at Virus Restrictions From Up North",https://www.nytimes.com/2020/09/28/world/europe/france-marseille-virus-restaurants.html?searchResultPosition=65,"The longstanding antagonism that pits Paris, the occasionally overbearing French capital, against Marseille, its sunnier, more rambunctious rival on the Mediterranean coast, has found a new battleground: the coronavirus."
"As Covid-19 Closes Schools, the World’s Children Go to Work",https://www.nytimes.com/2020/09/27/world/asia/covid-19-india-children-school-education-labor.html?searchResultPosition=67,"Every morning in front of the Devaraj Urs public housing apartment blocks on the outskirts of the city of Tumakuru, a swarm of children pours into the street."
There’s Gold in Them Thar Braes,https://www.nytimes.com/2020/09/27/world/europe/scotland-gold.html?searchResultPosition=69,"As a late afternoon mist rolled in over hills carpeted with purple heather, Alan Popovich stood knee deep in a fast-flowing river, weary but undaunted despite searching all day in the water without success."
"In Melbourne, Springtime Ushers in a New Sense of Hope",https://www.nytimes.com/2020/09/26/world/australia/melbourne-lockdown-hope.html?searchResultPosition=81,"There are blossoms on the trees in Melbourne and days of cold rain and blustering wind, but also days of sweet-smelling breezes and warm sunshine. This has been a hard year for my hometown, which is still undergoing one of the world’s strictest and longest lockdowns because of the pandemic."
Pandemic Will ‘Take Our Women 10 Years Back’ in the Workplace,https://www.nytimes.com/2020/09/26/world/covid-women-childcare-equality.html?searchResultPosition=82,"As if working mothers did not have enough to worry about, experts are now sounding the alarm that progress toward gender equality may be the latest in a long list of casualties of the coronavirus pandemic."
‘I Feel Sorry for Americans’: A Baffled World Watches the U.S.,https://www.nytimes.com/2020/09/25/world/asia/trump-united-states.html?searchResultPosition=83,Myanmar is a poor country struggling with open ethnic warfare and a coronavirus outbreak that could overload its broken hospitals. That hasn’t stopped its politicians from commiserating with a country they think has lost its way.
"Stranded Overseas, Thousands Beg Australia to Let Them Come Home",https://www.nytimes.com/2020/09/25/world/australia/stranded-overseas-coronavirus.html?searchResultPosition=85,"Alison Richards, a 38-year-old graphic designer, had been living in Britain for five years when she decided to move home to Australia. Then she got sick with Covid-19 and lost her job."
Kim Jong-un Offers South Korea Rare Apology for Killing of Official,https://www.nytimes.com/2020/09/25/world/asia/korea-kim-jong-un-apology-killing-defector.html?searchResultPosition=86,"North Korea’s leader, Kim Jong-un, offered a rare apology on Friday for the killing of a South Korean government official at sea by soldiers from the North, South Korea said."
"Famine Emerges as U.N. Theme, Crystallized by Yemen Disaster",https://www.nytimes.com/2020/09/24/world/middleeast/UN-Yemen-famine.html?searchResultPosition=87,"The coronavirus scourge is a prevailing theme at this year’s United Nations General Assembly, forcing the gathering to be conducted largely online. But the pandemic is also fueling another crisis preoccupying the organization and humanitarian groups: the strong prospect of famine in some of the world’s most destitute places."
Hong Kong Police Arrest Activist for Violating 2019 Mask Ban,https://www.nytimes.com/2020/09/24/world/asia/hong-kong-arrest-joshua-wong.html?searchResultPosition=88,"Joshua Wong, one of Hong Kong’s most visible pro-democracy activists, has been arrested multiple times for taking part in antigovernment protests that erupted over the past year and roiled the city for months before the coronavirus pandemic hit."
"As Virus Cases Surge in Europe, Hospitalizations Lag. But for How Long?",https://www.nytimes.com/2020/09/24/world/europe/covid-europe-hospitals-lockdowns.html?searchResultPosition=89,"In Munich, normally brimming with boisterous crowds for Oktoberfest this month, the authorities just banned gatherings of more than five people. In Marseille, France, all bars and restaurants will be closed next Monday. And in London, where the government spent weeks urging workers to return to the city’s empty skyscrapers, it is now asking them to work from home."
"Israel Tightens Holiday Lockdown, Restricting Prayers and Protests",https://www.nytimes.com/2020/09/24/world/middleeast/israel-covid-lockdown.html?searchResultPosition=101,"Warning that his country could be approaching “the edge of the abyss,” Prime Minister Benjamin Netanyahu imposed an even tighter lockdown than the one he announced last week to limit the spread of the coronavirus in Israel, which now has the highest rate of new cases per capita in the world."
"Even as Virus Surges, Hungary Forges Ahead With Super Cup Soccer Game",https://www.nytimes.com/2020/09/24/world/europe/super-cup-hungary-bayern-munich-sevilla.html?searchResultPosition=102,"Two top European soccer clubs, Bayern Munich and Sevilla, faced off as scheduled in front of thousands of fans in Budapest on Thursday night despite a sharp rise in coronavirus cases in Hungary."
A Manila Barbershop’s Mirrors Reflect the Pain of the Pandemic,https://www.nytimes.com/2020/09/24/world/asia/philippines-coronavirus-manila.html?searchResultPosition=103,"For 20 years, amid military coups, typhoons and terrorist attacks, Rollie Magalona’s clients have streamed into his barbershop in Metro Manila for more than just a cut and a shave."
North Korea Accused of Shooting and Burning South Korean Defector,https://www.nytimes.com/2020/09/24/world/asia/korea-defector-covid-19.html?searchResultPosition=104,"A South Korean official trying to defect to North Korea was killed by troops in the North who set his body on fire for fear he might be carrying the coronavirus, South Korean officials said on Thursday."
The Nose Needed for This Coronavirus Test Isn’t Yours. It’s a Dog’s.,https://www.nytimes.com/2020/09/23/world/europe/finland-dogs-airport-coronavirus.html?searchResultPosition=105,Travelers arriving at Helsinki’s airport are being offered a voluntary coronavirus test that takes 10 seconds with no uncomfortable nasal swab needed. And the test is done by a dog.
China’s Pledge to Be Carbon Neutral by 2060: What It Means,https://www.nytimes.com/2020/09/23/world/asia/china-climate-change.html?searchResultPosition=107,"Environmentalists have welcomed the pledge by China’s leader, Xi Jinping, to speed up reductions in emissions in the world’s top-polluting nation and reach carbon neutrality by 2060."
"In the Epicenter of Mexico’s Epicenter, Feeling Like a ‘Trapped Animal’",https://www.nytimes.com/2020/09/23/world/americas/mexico-coronavirus-covid-iztapalapa.html?searchResultPosition=109,"The man in the vegetable stall next to Christopher Arriaga’s died first. A longtime customer was next, then another. A few days later, an elderly carrot vendor got sick and died within the week."
A Somber Boris Johnson Offers Britain a New Plan to Halt the Virus,https://www.nytimes.com/2020/09/22/world/europe/boris-johnson-britain-plan-virus.html?searchResultPosition=121,"Prime Minister Boris Johnson has always looked for the silver lining in Britain’s response to the pandemic. Last spring, he promised to “send coronavirus packing” in 12 weeks. In the summer, he cajoled people to return to their offices and restaurants, even offering to subsidize their meals."
U.N. General Assembly: China Calls on World to Reject Politicization of Covid,https://www.nytimes.com/2020/09/22/world/asia/un-general-assembly-live-updates.html?searchResultPosition=122,"The presidents of the United States and China squared off in their speeches to the annual General Assembly on Tuesday, punctuating a superpower rivalry that the leader of the 193-member organization, Secretary-General António Guterres, has called a great global risk."
