title,links,first_paragraph
Pandemic Forces Car Dealers to Do the Unthinkable: Sell Online,https://www.nytimes.com/2020/05/29/business/car-dealers-sell-online-coronavirus.html?searchResultPosition=836,"After more than a decade of getting around New York City almost exclusively by subway and bus, Nicole Avallone decided to buy a car in April after watching the rapid spread of the coronavirus."
"Is It Safe to Keep Employing a Cleaner? Wrong Question, Lady",https://www.nytimes.com/2020/05/29/business/roxane-gay-work-friend.html?searchResultPosition=837,"Send questions about the office, money, careers and work-life balance to workfriend@nytimes.com. Include your name and location, or a request to remain anonymous. Letters may be edited."
Who Will Own the Cars That Drive Themselves?,https://www.nytimes.com/2020/05/29/business/ownership-autonomous-cars-coronavirus.html?searchResultPosition=838,"It was a difficult question even before the coronavirus pandemic hit: When self-driving cars eventually rule the roads, will Americans own their cars or make use of ride-hailing fleets?"
"Millions Relying on Pandemic Aid Can See Its End, and They’re Scared",https://www.nytimes.com/2020/05/28/business/economy/coronavirus-stimulus-unemployment.html?searchResultPosition=839,"For millions of Americans left out of work by the coronavirus pandemic, government assistance has been a lifeline preventing a plunge into poverty, hunger and financial ruin."
"The TV Commercial, Once Advertising’s Main Event, Suffers in the Pandemic",https://www.nytimes.com/2020/05/28/business/media/coronavirus-advertising.html?searchResultPosition=840,"Before the coronavirus pandemic, the TV networks were expecting a strong 2020. The presidential election and Tokyo Olympics would keep people watching, and companies would spend more than usual on commercial time."
‘Still Catching Up’: Jobless Numbers May Not Tell Full Story,https://www.nytimes.com/2020/05/28/business/economy/coronavirus-unemployment-claims.html?searchResultPosition=841,the equivalent of one out of every four American workers
U.S. Jobless Claims Pass 40 Million: Live Business Updates,https://www.nytimes.com/2020/05/28/business/unemployment-stock-market-coronavirus.html?searchResultPosition=842,The multitrillion-dollar patchwork of federal and state relief programs has not kept bills from piling up or prevented long lines at food banks. But it has mitigated the damage. Now the expiration of those programs represents a cliff that many Americans and the economy are hurtling toward.
"‘Just Sitting in Limbo.’ For Many Professionals, Careers Are on Hold.",https://www.nytimes.com/2020/05/27/business/coronavirus-careers-on-hold.html?searchResultPosition=843,"After five years at the wellness industry start-up she co-founded in San Francisco, Hasti Nazem decided it was time for her next adventure in Silicon Valley. Her last day was March 5."
Nursing Home Operator Genesis Details Coronavirus Aid,https://www.nytimes.com/2020/05/27/business/genesis-earnings-nursing-homes-coronavirus.html?searchResultPosition=844,"The nation’s biggest nursing home operator, Genesis HealthCare, has received more than $300 million in government grants and loans to help it grapple with the coronavirus pandemic that has killed about 1,500 of its residents."
"Disney World Is Reopening, but You Won’t Be Able to Hug Mickey",https://www.nytimes.com/2020/05/27/business/coronavirus-disney-world-reopening.html?searchResultPosition=845,"limiting the number of visitors, making face masks mandatory, deploying roaming squads to enforce social distancing, no longer allowing people to get up close and personal with Mickey Mouse"
Renault and Nissan Unveil Plan to Patch Tattered Alliance,https://www.nytimes.com/2020/05/27/business/renault-nissan-alliance.html?searchResultPosition=846,"Nissan and Renault, the quarrelsome main partners in the world’s largest automaking alliance, announced a plan on Wednesday to try to reset their troubled relationship as they seek to survive the coronavirus’s devastating impact on the car industry."
Amnesia Nation: Why China Has Forgotten Its Coronavirus Outbreak,https://www.nytimes.com/2020/05/27/business/china-coronavirus-amnesia.html?searchResultPosition=847,How quickly can a whole nation forget about a catastrophe?
"Dismal Earnings, Bullish Stock Investors and the Fed’s Invisible Hand",https://www.nytimes.com/2020/05/27/business/stock-market-coronavirus.html?searchResultPosition=848,"Wall Street analysts have grown increasingly pessimistic in recent weeks about the outlook for corporate profits, even as investors have pushed markets steadily higher, breaking the link between analyst forecasts and the direction of stock prices."
Reopening Optimism Helps Wall Street,https://www.nytimes.com/2020/05/27/business/stock-market-today-coronavirus.html?searchResultPosition=849,This briefing is no longer updating. Live updates can be found here. 
A Socially Distanced Las Vegas? What Are the Odds?,https://www.nytimes.com/2020/05/26/business/coronavirus-las-vegas-casinos.html?searchResultPosition=850,"For decades, the El Cortez Hotel & Casino in downtown Las Vegas has been known for single-deck blackjack."
‘Still Catching Up’: Jobless Numbers May Not Tell Full Story,https://www.nytimes.com/2020/05/28/business/economy/coronavirus-unemployment-claims.html?searchResultPosition=851,the equivalent of one out of every four American workers
U.S. Jobless Claims Pass 40 Million: Live Business Updates,https://www.nytimes.com/2020/05/28/business/unemployment-stock-market-coronavirus.html?searchResultPosition=852,The multitrillion-dollar patchwork of federal and state relief programs has not kept bills from piling up or prevented long lines at food banks. But it has mitigated the damage. Now the expiration of those programs represents a cliff that many Americans and the economy are hurtling toward.
"‘Just Sitting in Limbo.’ For Many Professionals, Careers Are on Hold.",https://www.nytimes.com/2020/05/27/business/coronavirus-careers-on-hold.html?searchResultPosition=853,"After five years at the wellness industry start-up she co-founded in San Francisco, Hasti Nazem decided it was time for her next adventure in Silicon Valley. Her last day was March 5."
Nursing Home Operator Genesis Details Coronavirus Aid,https://www.nytimes.com/2020/05/27/business/genesis-earnings-nursing-homes-coronavirus.html?searchResultPosition=854,"The nation’s biggest nursing home operator, Genesis HealthCare, has received more than $300 million in government grants and loans to help it grapple with the coronavirus pandemic that has killed about 1,500 of its residents."
"Disney World Is Reopening, but You Won’t Be Able to Hug Mickey",https://www.nytimes.com/2020/05/27/business/coronavirus-disney-world-reopening.html?searchResultPosition=855,"limiting the number of visitors, making face masks mandatory, deploying roaming squads to enforce social distancing, no longer allowing people to get up close and personal with Mickey Mouse"
Renault and Nissan Unveil Plan to Patch Tattered Alliance,https://www.nytimes.com/2020/05/27/business/renault-nissan-alliance.html?searchResultPosition=856,"Nissan and Renault, the quarrelsome main partners in the world’s largest automaking alliance, announced a plan on Wednesday to try to reset their troubled relationship as they seek to survive the coronavirus’s devastating impact on the car industry."
Amnesia Nation: Why China Has Forgotten Its Coronavirus Outbreak,https://www.nytimes.com/2020/05/27/business/china-coronavirus-amnesia.html?searchResultPosition=857,How quickly can a whole nation forget about a catastrophe?
"Dismal Earnings, Bullish Stock Investors and the Fed’s Invisible Hand",https://www.nytimes.com/2020/05/27/business/stock-market-coronavirus.html?searchResultPosition=858,"Wall Street analysts have grown increasingly pessimistic in recent weeks about the outlook for corporate profits, even as investors have pushed markets steadily higher, breaking the link between analyst forecasts and the direction of stock prices."
Reopening Optimism Helps Wall Street,https://www.nytimes.com/2020/05/27/business/stock-market-today-coronavirus.html?searchResultPosition=859,This briefing is no longer updating. Live updates can be found here. 
A Socially Distanced Las Vegas? What Are the Odds?,https://www.nytimes.com/2020/05/26/business/coronavirus-las-vegas-casinos.html?searchResultPosition=860,"For decades, the El Cortez Hotel & Casino in downtown Las Vegas has been known for single-deck blackjack."
Uber and Lyft Drivers Sue for New York Unemployment Benefits,https://www.nytimes.com/2020/05/26/business/economy/uber-drivers-unemployment-benefits.html?searchResultPosition=861,"Doh Ouattara drove for Uber and Lyft from 2016 until mid-March of this year, when he became concerned about the pandemic. With three children under 6 to provide for, he decided to apply for unemployment benefits."
Distressed Real Estate Market Beckons Opportunistic Buyers,https://www.nytimes.com/2020/05/26/business/distressed-commercial-real-esate-coronavirus.html?searchResultPosition=862,"Hoping to take advantage of wreckage in the wake of the coronavirus pandemic, investors are preparing to snap up commercial real estate at rock-bottom prices."
"The Reopening, in 5 Charts",https://www.nytimes.com/2020/05/26/business/dealbook/coronavirus-reopening-economy.html?searchResultPosition=863,Want this in your inbox each morning? Sign up here.
Keeping Clients Fit During the Pandemic by Going Virtual,https://www.nytimes.com/2020/05/26/business/small-business-coronavirus-fitness.html?searchResultPosition=864,"This article is part of Owning the Future, a series on how small businesses across the country are coping with the coronavirus pandemic."
China’s Young Struggle for Jobs in the Post-Outbreak Era,https://www.nytimes.com/2020/05/26/business/china-coronavirus-economy-jobs.html?searchResultPosition=865,"Before China can fully recover from the devastation of the coronavirus outbreak, it needs to find people like Huang Bing a job."
Classic Car Auctions Upended by Coronavirus,https://www.nytimes.com/2020/05/26/business/classic-car-auctions-coronavirus.html?searchResultPosition=866,"After collapsing last year, auctions for collector vehicles started 2020 on a roll, ringing up more than $300 million in sales at events in January in Scottsdale, Ariz., and in March on Amelia Island in Florida."
Stocks Rise on Hopes for Economic Recovery,https://www.nytimes.com/2020/05/26/business/stock-market-today-coronavirus.html?searchResultPosition=867,"Wall Street’s focus was on economic recovery Tuesday, and stocks rallied along with crude oil prices."
"As Meatpacking Plants Reopen, Data About Worker Illness Remains Elusive",https://www.nytimes.com/2020/05/25/business/coronavirus-meatpacking-plants-cases.html?searchResultPosition=868,"The Smithfield Foods plant in Tar Heel, N.C., is one of the world’s largest pork processing facilities, employing about 4,500 people and slaughtering roughly 30,000 pigs a day at its peak."
Lufthansa to Receive $10 Billion Bailout,https://www.nytimes.com/2020/05/25/business/lufthansa-bailout.html?searchResultPosition=869,"Lufthansa will receive a bailout worth 9 billion euros, or $9.8 billion, to help the airline survive an “existential emergency” caused by the pandemic and a virtual shutdown of passenger air traffic, the German government said Monday."
Wealthiest Hospitals Got Billions in Bailout for Struggling Health Providers,https://www.nytimes.com/2020/05/25/business/coronavirus-hospitals-bailout.html?searchResultPosition=870,"A multibillion-dollar institution in the Seattle area invests in hedge funds, runs a pair of venture capital funds and works with elite private equity firms like the Carlyle Group."
Uber and Lyft Drivers Sue for New York Unemployment Benefits,https://www.nytimes.com/2020/05/26/business/economy/uber-drivers-unemployment-benefits.html?searchResultPosition=871,"Doh Ouattara drove for Uber and Lyft from 2016 until mid-March of this year, when he became concerned about the pandemic. With three children under 6 to provide for, he decided to apply for unemployment benefits."
Distressed Real Estate Market Beckons Opportunistic Buyers,https://www.nytimes.com/2020/05/26/business/distressed-commercial-real-esate-coronavirus.html?searchResultPosition=872,"Hoping to take advantage of wreckage in the wake of the coronavirus pandemic, investors are preparing to snap up commercial real estate at rock-bottom prices."
"The Reopening, in 5 Charts",https://www.nytimes.com/2020/05/26/business/dealbook/coronavirus-reopening-economy.html?searchResultPosition=873,Want this in your inbox each morning? Sign up here.
Keeping Clients Fit During the Pandemic by Going Virtual,https://www.nytimes.com/2020/05/26/business/small-business-coronavirus-fitness.html?searchResultPosition=874,"This article is part of Owning the Future, a series on how small businesses across the country are coping with the coronavirus pandemic."
China’s Young Struggle for Jobs in the Post-Outbreak Era,https://www.nytimes.com/2020/05/26/business/china-coronavirus-economy-jobs.html?searchResultPosition=875,"Before China can fully recover from the devastation of the coronavirus outbreak, it needs to find people like Huang Bing a job."
Classic Car Auctions Upended by Coronavirus,https://www.nytimes.com/2020/05/26/business/classic-car-auctions-coronavirus.html?searchResultPosition=876,"After collapsing last year, auctions for collector vehicles started 2020 on a roll, ringing up more than $300 million in sales at events in January in Scottsdale, Ariz., and in March on Amelia Island in Florida."
Stocks Rise on Hopes for Economic Recovery,https://www.nytimes.com/2020/05/26/business/stock-market-today-coronavirus.html?searchResultPosition=877,"Wall Street’s focus was on economic recovery Tuesday, and stocks rallied along with crude oil prices."
"As Meatpacking Plants Reopen, Data About Worker Illness Remains Elusive",https://www.nytimes.com/2020/05/25/business/coronavirus-meatpacking-plants-cases.html?searchResultPosition=878,"The Smithfield Foods plant in Tar Heel, N.C., is one of the world’s largest pork processing facilities, employing about 4,500 people and slaughtering roughly 30,000 pigs a day at its peak."
Lufthansa to Receive $10 Billion Bailout,https://www.nytimes.com/2020/05/25/business/lufthansa-bailout.html?searchResultPosition=879,"Lufthansa will receive a bailout worth 9 billion euros, or $9.8 billion, to help the airline survive an “existential emergency” caused by the pandemic and a virtual shutdown of passenger air traffic, the German government said Monday."
Wealthiest Hospitals Got Billions in Bailout for Struggling Health Providers,https://www.nytimes.com/2020/05/25/business/coronavirus-hospitals-bailout.html?searchResultPosition=880,"A multibillion-dollar institution in the Seattle area invests in hedge funds, runs a pair of venture capital funds and works with elite private equity firms like the Carlyle Group."
"As Passengers Disappeared, Airlines Filled Planes With Cargo",https://www.nytimes.com/2020/05/25/business/coronavirus-airlines-cargo-passengers.html?searchResultPosition=881,"Most passenger planes today fly virtually empty, but when Virgin Atlantic flight VS251 landed at Heathrow Airport near London on a cloudy afternoon late last month, most of its 258 seats were occupied."
This Car’s Yearly Tune-Up Costs as Much as a Civic,https://www.nytimes.com/2020/05/25/business/bugatti-chiron-price.html?searchResultPosition=882,"I’ve never piloted the Concorde; but in early March, just before the coronavirus-fueled lockdown, I drove what may be the closest road equivalent to a luxury aircraft: the Bugatti Chiron."
The New Model Media Star Is Famous Only to You,https://www.nytimes.com/2020/05/24/business/media/new-model-celebrity.html?searchResultPosition=883,"Back in March, I was trying to persuade my dad to stop taking the subway to work in Manhattan and join me upstate. So I paid $75 to Leonard Marshall, a retired New York Giants defensive lineman we both loved in the 1980s, to send the message."
The Week in Business: The End of the Office as We Know It,https://www.nytimes.com/2020/05/24/business/the-week-in-business-coronavirus-work-office-jobless.html?searchResultPosition=884,"Holiday weekends seem a little strange when Saturdays feel the same as Tuesdays and you can’t really go anywhere, but have a good Memorial Day all the same! Here’s what you need to know in business and tech for the short week ahead. "
Pay Cuts Become a Tool for Some Companies to Avoid Layoffs,https://www.nytimes.com/2020/05/24/business/economy/coronavirus-pay-cuts.html?searchResultPosition=885,"It was late and Martin A. Kits van Heyningen feared he was letting the team down at the company he co-founded, KVH Industries. Rather than lay off workers in response to the coronavirus pandemic, he had decided to cut salaries, and when he emailed a video explaining his decision at 3 a.m. last month, he was prepared for a barrage of complaints."
The Artisans Behind Italian Fashion Tremble at Their Future,https://www.nytimes.com/2020/05/23/business/italy-luxury-fashion-coronavirus.html?searchResultPosition=886,"Until recently, some of the most intricately embroidered fabrics in the world, like those found in garments designed by Giorgio Armani, Valentino, Etro and Prada, have come out of a duplex apartment complex in Milan, the home of a small business called Pino Grasso Ricami."
"Hertz, Car Rental Pioneer, Files for Bankruptcy Protection",https://www.nytimes.com/2020/05/22/business/hertz-bankruptcy-coronavirus-car-rental.html?searchResultPosition=887,"Hertz, which started with a fleet of a dozen Ford Model T’s a century ago and became one of the world’s largest car rental companies, filed for bankruptcy protection on Friday after falling victim to its mountain of debt."
Airlines Given Tentative OK to Halt Service at Dozens of U.S. Cities,https://www.nytimes.com/2020/05/22/business/coronavirus-airports-airlines.html?searchResultPosition=888,"The Transportation Department said late Friday that it would tentatively allow 15 airlines to stop flights to about 60 mostly small and midsize cities, though none of the destinations stand to lose service entirely."
What Role Should Employers Play in Testing Workers?,https://www.nytimes.com/2020/05/22/business/employers-coronavirus-testing.html?searchResultPosition=889,"As the country reopens, employers are looking into how to safely bring back their workers. One recurring question: Should they be tested for the new coronavirus?"
Reduced Demand for Electricity Leads to Power Giveaways,https://www.nytimes.com/2020/05/22/business/negative-electricity-rates.html?searchResultPosition=890,"The coronavirus pandemic has played havoc with energy markets. Last month, the price of benchmark American crude oil fell below zero as the economy shut down and demand plunged."
"As Passengers Disappeared, Airlines Filled Planes With Cargo",https://www.nytimes.com/2020/05/25/business/coronavirus-airlines-cargo-passengers.html?searchResultPosition=891,"Most passenger planes today fly virtually empty, but when Virgin Atlantic flight VS251 landed at Heathrow Airport near London on a cloudy afternoon late last month, most of its 258 seats were occupied."
This Car’s Yearly Tune-Up Costs as Much as a Civic,https://www.nytimes.com/2020/05/25/business/bugatti-chiron-price.html?searchResultPosition=892,"I’ve never piloted the Concorde; but in early March, just before the coronavirus-fueled lockdown, I drove what may be the closest road equivalent to a luxury aircraft: the Bugatti Chiron."
The New Model Media Star Is Famous Only to You,https://www.nytimes.com/2020/05/24/business/media/new-model-celebrity.html?searchResultPosition=893,"Back in March, I was trying to persuade my dad to stop taking the subway to work in Manhattan and join me upstate. So I paid $75 to Leonard Marshall, a retired New York Giants defensive lineman we both loved in the 1980s, to send the message."
The Week in Business: The End of the Office as We Know It,https://www.nytimes.com/2020/05/24/business/the-week-in-business-coronavirus-work-office-jobless.html?searchResultPosition=894,"Holiday weekends seem a little strange when Saturdays feel the same as Tuesdays and you can’t really go anywhere, but have a good Memorial Day all the same! Here’s what you need to know in business and tech for the short week ahead. "
Pay Cuts Become a Tool for Some Companies to Avoid Layoffs,https://www.nytimes.com/2020/05/24/business/economy/coronavirus-pay-cuts.html?searchResultPosition=895,"It was late and Martin A. Kits van Heyningen feared he was letting the team down at the company he co-founded, KVH Industries. Rather than lay off workers in response to the coronavirus pandemic, he had decided to cut salaries, and when he emailed a video explaining his decision at 3 a.m. last month, he was prepared for a barrage of complaints."
The Artisans Behind Italian Fashion Tremble at Their Future,https://www.nytimes.com/2020/05/23/business/italy-luxury-fashion-coronavirus.html?searchResultPosition=896,"Until recently, some of the most intricately embroidered fabrics in the world, like those found in garments designed by Giorgio Armani, Valentino, Etro and Prada, have come out of a duplex apartment complex in Milan, the home of a small business called Pino Grasso Ricami."
"Hertz, Car Rental Pioneer, Files for Bankruptcy Protection",https://www.nytimes.com/2020/05/22/business/hertz-bankruptcy-coronavirus-car-rental.html?searchResultPosition=897,"Hertz, which started with a fleet of a dozen Ford Model T’s a century ago and became one of the world’s largest car rental companies, filed for bankruptcy protection on Friday after falling victim to its mountain of debt."
Airlines Given Tentative OK to Halt Service at Dozens of U.S. Cities,https://www.nytimes.com/2020/05/22/business/coronavirus-airports-airlines.html?searchResultPosition=898,"The Transportation Department said late Friday that it would tentatively allow 15 airlines to stop flights to about 60 mostly small and midsize cities, though none of the destinations stand to lose service entirely."
What Role Should Employers Play in Testing Workers?,https://www.nytimes.com/2020/05/22/business/employers-coronavirus-testing.html?searchResultPosition=899,"As the country reopens, employers are looking into how to safely bring back their workers. One recurring question: Should they be tested for the new coronavirus?"
Reduced Demand for Electricity Leads to Power Giveaways,https://www.nytimes.com/2020/05/22/business/negative-electricity-rates.html?searchResultPosition=900,"The coronavirus pandemic has played havoc with energy markets. Last month, the price of benchmark American crude oil fell below zero as the economy shut down and demand plunged."
Rock-Bottom Interest Rates May Be Here to Stay,https://www.nytimes.com/2020/05/22/business/economy/fed-interest-rates-coronavirus.html?searchResultPosition=901,and the path for interest rates
Another Casualty of the Coronavirus: Summer Internships,https://www.nytimes.com/2020/05/22/business/coronavirus-summer-internships.html?searchResultPosition=902,"When she found out in mid-March that she had landed an internship with an education nonprofit in Washington, Lydia Burns, a senior at the University of Louisville, called her mother to celebrate. The whole world was falling apart, but here, finally, was good news."
"As Coronavirus Keeps the West at Bay, China Moves to Tame Hong Kong",https://www.nytimes.com/2020/05/22/business/china-hong-kong-national-security.html?searchResultPosition=903,"China’s leader, Xi Jinping, has made one of his boldest political gambits yet, wagering that he can tame Hong Kong through national security legislation, despite the risk of fresh upheavals there and a new flash point with the United States."
Mark Zuckerberg Rethinks the Office,https://www.nytimes.com/2020/05/22/business/dealbook/facebook-zuckerberg-office-jobs.html?searchResultPosition=904,Want this in your inbox each morning? Sign up here.
What Happened to the Great American Logistics Machine?,https://www.nytimes.com/2020/05/22/business/logistics-supply-chains.html?searchResultPosition=905,"It started with silence, or something close to silence, or perhaps it was simply the absence of a low-level hum that nobody knew was humming until it stopped. In the quiet we realized that, until the pandemic arrived, we had lived in a vast, elaborate, whirring contraption that delivered culture and commerce at spectacular speeds, with astonishing efficiency."
‘Working People Want Real Change’: A Union Chief Sounds Off on the Crisis,https://www.nytimes.com/2020/05/22/business/mary-kay-henry-seiu-corner-office.html?searchResultPosition=906,"Growing up as the oldest girl among 10 siblings in a large Catholic family in Detroit, Mary Kay Henry learned the power of collective action at an early age. Sometimes, she and her older brother would have to get all their siblings ready for school, packing lunches, getting kids dressed and shepherding everyone on to the bus."
"Hertz, Car Rental Pioneer, Files for Bankruptcy Protection",https://www.nytimes.com/2020/05/22/business/stock-market-live-coronavirus.html?searchResultPosition=907,This briefing is no longer being updated. Follow live market developments here. 
"China, Faced With Challenges, Mounts Show of Strength at Congress Session",https://www.nytimes.com/2020/05/21/business/economy/coronavirus-china-economy.html?searchResultPosition=908,"China’s top leaders on Friday made a show of strength to confront defiance in Hong Kong and the economic damage wrought by the coronavirus outbreak, even as they acknowledged that both had dealt a blow to the ruling Communist Party’s agenda."
