title,links,first_paragraph
Macron Beat Back the Coronavirus. France Is Not Impressed.,https://www.nytimes.com/2020/06/05/world/europe/coronavirus-france-macron-reopening.html?searchResultPosition=1082,"President Emmanuel Macron’s government has beaten back the coronavirus, prevented mass layoffs, propped up the salaries of the unemployed, staved off long food lines, and achieved a lower death rate than its neighbors, Germany excepted."
How the Coronavirus Makes a No-Deal Brexit More Likely,https://www.nytimes.com/2020/06/05/world/europe/brexit-coronavirus-uk.html?searchResultPosition=1084,"The coronavirus epidemic in Britain has killed more than 40,000 people, sickened hundreds of thousands more, including Prime Minister Boris Johnson, and paralyzed the economy. Now it may claim another casualty: a trade agreement between Britain and the European Union."
"Musicians Playing Through the Lockdown, to One Listener at a Time",https://www.nytimes.com/2020/06/05/world/europe/germany-stuttgart-coronavirus-reopening.html?searchResultPosition=1086,"Patrick Kingsley, an international correspondent, and Laetitia Vancon, a photojournalist, are driving more than 3,700 miles to explore the reopening of the European continent after coronavirus lockdowns. Read all their dispatches."
Mexico Is Reopening After Quarantine. Many Worry It’s Too Early.,https://www.nytimes.com/2020/06/05/world/americas/coronavirus-mexico-reopening.html?searchResultPosition=1087,Packed street markets. Buzzing metro stations. Thronged sidewalks. And noticeably fewer people wearing masks.
Coronavirus Rips Into Regions Previously Spared,https://www.nytimes.com/2020/06/04/world/middleeast/coronavirus-egypt-america-africa-asia.html?searchResultPosition=1089,"For months, one enduring mystery of the coronavirus was why some of the world’s most populous countries, with rickety health systems and crowded slums, had managed to avoid the brunt of an outbreak that was burning through relatively affluent societies in Europe and the United States."
Amsterdam’s Red Light Zone Stays Shut as Rest of City Edges Open,https://www.nytimes.com/2020/06/03/world/europe/amsterdam-red-light-coronavirus.html?searchResultPosition=1104,"The red lights still shone above the windows in De Wallen, Amsterdam’s main red-light district, but the windows themselves were empty."
What Will It Take to Reopen the World to Travel?,https://www.nytimes.com/2020/06/03/world/australia/coronavirus-travel-bubble.html?searchResultPosition=1105,"After months of locked-down borders, countries that have stifled the coronavirus are trying to choreograph a risky dance: how to bring back visitors without importing another burst of uncontrolled contagion."
Powerful Cyclone Lashes Mumbai as City Grapples With Coronavirus,https://www.nytimes.com/2020/06/03/world/asia/cyclone-nisarga-india-mumbai.html?searchResultPosition=1106,"A powerful cyclone slammed into India’s coast Wednesday afternoon, striking the commercial hub of Mumbai, lashing beach towns with heavy rain and strong winds, and pushing thousands of people into emergency shelters."
"Yemen Aid Falls Short, Threatening Food and Health Programs",https://www.nytimes.com/2020/06/02/world/middleeast/yemen-saudi-united-nations-aid.html?searchResultPosition=1107,"International donors pledged about $1.35 billion in humanitarian aid for Yemen on Tuesday, far short of the $2.4 billion the United Nations had said was needed to pull a country shredded by years of war, hunger and disease from the brink of further disaster."
"Embattled at Home, Trump Finds Himself Isolated Abroad, Too",https://www.nytimes.com/2020/06/02/world/europe/trump-merkel-allies.html?searchResultPosition=1110,"With American cities burning and the coronavirus still raging, killing more people than in any other country, President Trump also has growing problems overseas. He has never before been so isolated and ignored, even mocked."
"As Protests Engulf the United States, China Revels in the Unrest",https://www.nytimes.com/2020/06/02/world/asia/china-george-floyd.html?searchResultPosition=1121,"The cartoon shows the Statue of Liberty cracking into pieces, a police officer breaking through its copper robe. A man’s head lies on the ground in front of the White House, its facade splattered with blood."
"New Ebola Outbreak in Congo, Already Hit by Measles and Coronavirus",https://www.nytimes.com/2020/06/01/world/africa/ebola-outbreak-congo.html?searchResultPosition=1124,"A fresh outbreak of the deadly Ebola virus has flared up in the Democratic Republic of Congo, a country that was already contending with the world’s largest measles epidemic, as well as the coronavirus."
Putin Sets New Date for Vote on Extending His Rule,https://www.nytimes.com/2020/06/01/world/europe/russia-putin-coronavirus.html?searchResultPosition=1125,"Pushing to get his political program back on track, President Vladimir V. Putin of Russia said on Monday that a referendum on constitutional changes that would allow him to dispense with term limits and stay in office until 2036 would be held on July 1."
"Global Anger Grows Over George Floyd Death, and Becomes an Anti-Trump Cudgel",https://www.nytimes.com/2020/06/01/world/asia/george-floyd-protest-global.html?searchResultPosition=1127,"Mass protests over the police killing of another black man in the United States spread globally in the past few days, as many demonstrators not only expressed solidarity with their American counterparts but denounced racism in their own countries."
"Resisting Lockdown, Nicaragua Becomes a Place of Midnight Burials",https://www.nytimes.com/2020/05/31/world/americas/coronavirus-nicaragua-burials.html?searchResultPosition=1129,"Just hours after Yamil Acevedo died in a hospital, funeral home workers in hazardous materials suits strapped his coffin to the back of a pickup truck, drove it to a cemetery and buried him in the dark of night."
Coronavirus Turns a Spanish Sea Delicacy Back Into Daily Fare,https://www.nytimes.com/2020/05/31/world/europe/coronavirus-prawn-spain.html?searchResultPosition=1141,"With an intensity of flavor to match their color, the big, bright-red prawns caught off Spain’s eastern coast are the kind of delicacy that someone might eat once or twice in a year and remember fondly for the rest of it."
U.S. Sends Two Million Doses of Hydroxychloroquine to Brazil,https://www.nytimes.com/2020/05/31/world/coronavirus-news.html?searchResultPosition=1143,"The United States has delivered two million doses of a malaria drug to Brazil for use in the fight against the coronavirus pandemic, and the two countries are embarking on a joint research effort to study whether the drug is safe and effective for the prevention and early treatment of Covid-19, the White House announced Sunday."
"China and India Brawl at 14,000 Feet Along the Border",https://www.nytimes.com/2020/05/30/world/asia/india-china-border.html?searchResultPosition=1144,"High in the Himalayas, an enormous fistfight erupted in early May between the soldiers of China and India. Brawls at 14,000 feet along their inhospitable and disputed frontier are not terribly unusual, but what happened next was."
"In Some Nations, Coronavirus Is Only One of Many Outbreaks",https://www.nytimes.com/2020/05/30/world/americas/virus-central-america-dengue.html?searchResultPosition=1145,"A dengue epidemic ravaged Honduras last year, sickening over 100,000 people and leaving 180 dead. As this year began, officials braced for another surge in cases of the mosquito-borne disease and wondered how they would manage with their frail public health system and shortage of trained personnel."
"Coronavirus Slams Broken, Embattled Yemen",https://www.nytimes.com/2020/05/30/world/middleeast/virus-yemen.html?searchResultPosition=1146,"In northern Yemen, more and more people are falling ill and dying after having trouble breathing, yet the Iran-backed group that controls the region, the Houthis, has acknowledged only a few coronavirus deaths."
When Going to Work Means Taking a Calculated Risk,https://www.nytimes.com/2020/05/29/world/canada/essential-workers.html?searchResultPosition=1150,Last week I spoke with one of Canada’s leading experts about the effects of working from home. But the coronavirus shutdown has also created a class of people who still go to their regular workplaces but may not want to be there.
"In Brazil, a President Under Fire Lashes Out at Investigators",https://www.nytimes.com/2020/05/29/world/americas/brazil-bolsonaro-supreme-court.html?searchResultPosition=1161,"The embattled president of Brazil stood outside his mansion on Thursday, indignant and angry, wearing a necktie patterned with assault rifles."
"Older Italians Warily Eye Young Crowds, Fearing 2nd Coronavirus Wave",https://www.nytimes.com/2020/05/29/world/europe/italy-young-people-coronavirus.html?searchResultPosition=1164,"After months of living under a strict lockdown in Italy, a closely gathered group of teenagers welcomed a warm evening this week at a verdant park in Milan, gazing at phone screens, embracing and forming a small circle around a playful dog. No one wore a mask."
"Its Coronavirus Caseload Soaring, India Is Reopening Anyway",https://www.nytimes.com/2020/05/29/world/asia/coronavirus-india-lockdown.html?searchResultPosition=1165,"Its coronavirus cases are skyrocketing, putting it among the world’s most worrisome pandemic zones in recent weeks. Nonetheless, India is reopening, lifting its lockdown at what experts fear may be the worst time."
"‘It’s Too Late’: In Sprawling Indonesia, Coronavirus Surges",https://www.nytimes.com/2020/05/28/world/asia/indonesia-coronavirus-surge.html?searchResultPosition=1170,"The 1,340 Maluku Islands are a long way from anywhere. So remote are these Indonesian isles that the country’s most famous novelist was imprisoned there in a gulag that was actually an archipelago."
Proud of Your Lockdown Baking? This Man Built a Giant Kookaburra,https://www.nytimes.com/2020/05/28/world/australia/kookaburra-quarantine.html?searchResultPosition=1181,"Some have taken to baking to while away the hours during coronavirus lockdown; others embraced gardening. For Farvardin Daliri, it was the perfect opportunity to complete his magnum opus: a 15-foot-tall replica of a bird known as a laughing kookaburra."
"‘It’s Not the Virus’: Mexico’s Broken Hospitals Become Killers, Too",https://www.nytimes.com/2020/05/28/world/americas/virus-mexico-doctors.html?searchResultPosition=1182,The senseless deaths torment doctors and nurses the most: The man who died because an inexperienced nurse unplugged his ventilator. The patient who died from septic shock because no one monitored his vital signs. The people whose breathing tubes clogged after being abandoned in their hospital beds for hours on end.
A €750 Billion Virus Recovery Plan Thrusts Europe Into a New Frontier,https://www.nytimes.com/2020/05/27/world/europe/coronavirus-europe-bailout.html?searchResultPosition=1184,"For decades, even when the 2008 financial crisis threatened to blow the bloc apart, the European Union’s wealthier nations resisted the notion of collective debt. But the coronavirus has so fundamentally damaged the bloc’s economy that it is now forcing European leaders to consider the sort of unified and sweeping response once thought unworkable."
Boris Johnson Defends ‘Toxic’ Aide Again. Why Protect a Political Burden?,https://www.nytimes.com/2020/05/27/world/europe/boris-johnson-cummings-cooper.html?searchResultPosition=1185,"Prime Minister Boris Johnson went to the mat yet again on Wednesday for his embattled adviser, Dominic Cummings, signaling to lawmakers that he had no plans to dismiss Mr. Cummings for breaching the rules by driving 260 miles to his parents’ house during the country’s coronavirus lockdown."
‘Overtaken by Aliens’: India Faces Another Plague as Locusts Swarm,https://www.nytimes.com/2020/05/27/world/asia/india-locusts-jaipur.html?searchResultPosition=1188,"Magan Doodi, a groundskeeper at a golf course in Jaipur, was making his rounds earlier this week when he saw the sky suddenly turn a weird pink."
Canada’s ‘Voice of the Nation’ Rings Out in a Capital Quieted by a Virus,https://www.nytimes.com/2020/05/27/world/canada/ottawa-peace-tower-coronavirus.html?searchResultPosition=1190,Finding a spot on the sweeping lawn in front of Canada’s ornately Gothic Parliament buildings to hear a concert this month was not a problem in the middle of a pandemic.
"Visiting My Grandparents, Separated by Plexiglass",https://www.nytimes.com/2020/05/26/world/europe/coronavirus-france-nursing-homes.html?searchResultPosition=1203,"Elian Peltier, who is based in London, covered the coronavirus pandemic in Spain before returning to his home country, France. We asked him to tell us about a visit to his grandparents."
Dominic Cummings Offers a Sorry-Not-Sorry for U.K. Lockdown Breach,https://www.nytimes.com/2020/05/25/world/europe/dominic-cummings-boris-johnson-coronavirus.html?searchResultPosition=1206,"Prime Minister Boris Johnson took a breathtaking gamble with his own popularity on Monday, allowing his closest aide to go public with a detailed, yet stubbornly unapologetic, explanation for making a 260-mile journey that broke lockdown rules and ignited a political firestorm in Britain."
ISIS Prisoners Threaten U.S. Mission in Northeastern Syria,https://www.nytimes.com/2020/05/25/world/middleeast/isis-prisoners-syria.html?searchResultPosition=1207,"A year after American-backed forces seized the last remnant of territory under Islamic State rule in Syria, some 10,000 captured ISIS fighters in Kurdish-run wartime prisons pose “a significant risk” to the United States mission in the country’s northeast, military commanders say."
"On a Scottish Isle, Nursing Home Deaths Expose a Covid-19 Scandal",https://www.nytimes.com/2020/05/25/world/europe/coronavirus-uk-nursing-homes.html?searchResultPosition=1208,"On the Isle of Skye off the western coast of Scotland, residents thought they had sealed themselves off from the coronavirus. They shuttered hotels. Officials warned of police checks. Traffic emptied on the only bridge from the mainland."
Coronavirus Threatens China’s Devotion to Chopsticks and Sharing Food,https://www.nytimes.com/2020/05/25/world/asia/china-coronavirus-chopsticks.html?searchResultPosition=1209,"At Chilli Kitchen in Beijing, spicy and mouth-numbing Sichuan dishes are laid out family style. Using red chopsticks, diners dive into steaming bowls of pork wontons bathed in fragrant chili oil and sesame seeds, and rummage through platters filled with dried red chili peppers to unearth juicy bits of roasted fish."
"Putin Speaks, Officials Shrug, and Doctors Are Caught in the Middle",https://www.nytimes.com/2020/05/25/world/europe/putin-russia-coronavirus.html?searchResultPosition=1210,"Assailed by critics as an absentee leader at the start of the coronavirus crisis in Russia, President Vladimir V. Putin re-emerged with a splash on state television last month to show that he cared and was taking charge."
"Spain’s Courts, Already Strained, Face Crisis as Lockdown Lifts",https://www.nytimes.com/2020/05/25/world/europe/spain-courts-coronavirus.html?searchResultPosition=1221,"A flood of new court cases, some with little precedent, is expected to deluge a Spanish judicial system already gasping for breath, bogged down by delays and lagging in technology."
New Zealand Earthquake Interrupts Jacinda Ardern’s TV Interview,https://www.nytimes.com/2020/05/24/world/asia/jacinda-ardern-new-zealand-earthquake.html?searchResultPosition=1223,"A sizable earthquake struck New Zealand on Monday, shaking Prime Minister Jacinda Ardern during a live television interview, but failing to cause major damage or disrupt Ms. Ardern’s calm demeanor."
Boris Johnson Backs Top Aide Accused of Flouting Lockdown Rules,https://www.nytimes.com/2020/05/24/world/europe/uk-cummings-coronavirus.html?searchResultPosition=1225,"Prime Minister Boris Johnson, defying a storm of criticism, said on Sunday that he would not dismiss his most influential adviser, Dominic Cummings, for breaching Britain’s lockdown rules by driving across the country to visit relatives, even when he was falling ill with the coronavirus."
Push to Reopen Houses of Worship in Europe and Mideast Brings Perils and Tensions,https://www.nytimes.com/2020/05/24/world/europe/germany-france-church-mosque-coronavirus.html?searchResultPosition=1226,"As nations weigh the calculus of reopening parts of society after locking down because of the coronavirus, Germany has plunged ahead after bringing its outbreak under control, reopening houses of worship and allowing the faithful to gather again in larger numbers."
"For Some Italians, the Future of Work Looks Like the Past",https://www.nytimes.com/2020/05/24/world/europe/italy-farms-coronavirus.html?searchResultPosition=1227,"On a small farm outside Rome, workers crouched in the corridors of a cornfield and tended to stalks for the coming harvest. The ones from Morocco, Romania and Nigeria knew exactly what to do. It was the new Italian hires who needed help."
Hong Kong Police Fire Tear Gas as Protesters Resist China’s Grip,https://www.nytimes.com/2020/05/24/world/asia/hong-kong-protest-coronavirus-china.html?searchResultPosition=1228,"Thousands of protesters swarmed some of Hong Kong’s busiest neighborhoods on Sunday, singing, chanting and erecting roadblocks of torn-up bricks and debris, as the police repeatedly fired tear gas, pepper spray and a water cannon during the city’s largest street mobilization in months."
Afghan Sides Agree to Rare Cease-Fire During Eid al-Fitr,https://www.nytimes.com/2020/05/24/world/asia/afghanistan-taliban-cease-fire-eid.html?searchResultPosition=1229,"The Taliban and the Afghan government announced a cease-fire for the three days of the Islamic festival Eid al-Fitr, which starts on Sunday in Afghanistan, offering the war-torn nation a rare respite from violence that has been intensifying."
Is It Time to Stop Clapping for Health Care Workers? An Organizer Thinks So,https://www.nytimes.com/2020/05/23/world/europe/uk-clap-for-carers-nhs-coronavirus.html?searchResultPosition=1241,"On Thursday nights, Britons bang pots and pans and let out hearty cheers of support for doctors and nurses who care for coronavirus patients and for other essential workers amid the pandemic."
"Rattled by a Pandemic, People Turn to Leaders — Any Leaders",https://www.nytimes.com/2020/05/23/world/asia/virus-leaders-popularity.html?searchResultPosition=1242,"As world leaders grapple with when and how to safely reopen their countries, many are also facing a political problem: how to maintain support as they oversee tanking economies, stifling restrictions and staggering death tolls."
European Defense and ‘Strategic Autonomy’ Are Also Coronavirus Victims,https://www.nytimes.com/2020/05/23/world/europe/defense-autonomy-europe-coronavirus.html?searchResultPosition=1244,"The coronavirus has upended the best-laid plans and priorities of many, including the European Union. But one of the biggest casualties may be European efforts to build a more credible and independent European military."
Jacinda Ardern Sold a Drastic Lockdown With Straight Talk and Mom Jokes,https://www.nytimes.com/2020/05/23/world/asia/jacinda-ardern-coronavirus-new-zealand.html?searchResultPosition=1245,"Halfway into a Facebook Live video last week, updating the world on New Zealand’s plan to reopen restaurants, schools and even movie theaters, Prime Minister Jacinda Ardern noticed a concern cropping up among the commenters: They thought she looked tired."
Virus Lockdown Forces Iran Into Its First Virtual Quds Day,https://www.nytimes.com/2020/05/22/world/middleeast/virus-virtual-quds-day.html?searchResultPosition=1247,"For the past four decades, on the last Friday of Ramadan, supporters of Iran’s government have marched to denounce Israel. They burn Israel’s flag. They mock effigies of the leaders of Israel and of its patron, the United States. They chant pledges to liberate Jerusalem, or Quds, as the city is known in Arabic."
What’s Lost and Gained When We Put In 9-to-5 From Home?,https://www.nytimes.com/2020/05/22/world/canada/canada-working-from-home.html?searchResultPosition=1248,"On Thursday, Tobi Lütke, the founder and chief executive of Ottawa-based Shopify, announced on Twitter that most of his company’s 5,000 employees had permanently become stay-at-home workers."
Argentina Tries to Escape Default as It Misses Bond Payment,https://www.nytimes.com/2020/05/22/world/americas/argentina-default.html?searchResultPosition=1250,"Argentina missed a bond payment on Friday and inched closer to another crushing default, which would plunge it into a new period of economic isolation and deepen a recession that has been exacerbated by the coronavirus pandemic."
Britain Orders a 14-Day Quarantine on Arriving Travelers,https://www.nytimes.com/2020/05/22/world/europe/virus-britain-travel-quarantine.html?searchResultPosition=1261,"Britain on Friday moved ahead with a 14-day mandatory quarantine on arriving travelers, and heavy fines for those who break the rules, outlining strict new travel restrictions as other European nations are thinking about easing theirs."
"Coronavirus Cases Fall in Europe’s Capitals, but Fears Over Reopening Linger",https://www.nytimes.com/2020/05/22/world/europe/coronavirus-reopening.html?searchResultPosition=1262,"During a week of bluebird skies and Mediterranean temperatures, when sunbathers thronged parks and cars poured back onto streets, one sound has been notably absent in London: the wail of ambulance sirens."
Why the Call to Prayer Made Me Cry This Ramadan,https://www.nytimes.com/2020/05/22/world/africa/coronavirus-ramadan-east-africa.html?searchResultPosition=1263,Abdi Latif Dahir is a Kenyan who was appointed the East Africa correspondent for The New York Times last year. He has fasted every day of Ramadan since he was 9 years old.
Democracy Fades in Malaysia as Old Order Returns to Power,https://www.nytimes.com/2020/05/22/world/asia/malaysia-politics-najib.html?searchResultPosition=1266,"The members of Malaysia’s Parliament, wearing face masks to match their crisp white uniforms, convened this week in the vast lower house chamber for the first time this year."
U.K. to Quarantine All Incoming Air Travelers; a Chinese Coronavirus Vaccine Shows Promise,https://www.nytimes.com/2020/05/22/world/live-coronavirus-world-cases.html?searchResultPosition=1267,"Britain will quarantine everyone flying into the country, including citizens, for 14 days beginning June 8 to fight the spread of the coronavirus, Home Secretary Priti Patel announced on Friday."
Boris Johnson Avoids Criminal Inquiry Into His Dealings as London’s Mayor,https://www.nytimes.com/2020/05/21/world/europe/boris-johnson-jennifer-arcuri-uk.html?searchResultPosition=1268,A British police watchdog agency said on Thursday that it would not conduct a criminal investigation into Prime Minister Boris Johnson over claims that as mayor of London he had done official favors for an American businesswoman whose apartment he sometimes visited during working hours.
Cyclone Amphan’s Death Toll Rises to 80 in India and Bangladesh,https://www.nytimes.com/2020/05/21/world/asia/cyclone-amphan-india-bangladesh.html?searchResultPosition=1269,"More than 80 people were killed by the powerful cyclone that slammed into India and Bangladesh on Wednesday, wiping out thousands of homes and drenching low-lying areas in torrential rain, officials said on Thursday."
Coronavirus Changed China’s Big Political Event. Here’s What to Expect.,https://www.nytimes.com/2020/05/21/world/asia/china-coronavirus-national-peoples-congress.html?searchResultPosition=1270,"China’s biggest event on the political calendar, the annual session of the National People’s Congress, is always a tightly choreographed legislative pageant aimed at conveying the strength of the ruling Communist Party."
"In Istanbul Under Lockdown, Baklava Makers Are Essential Workers",https://www.nytimes.com/2020/05/21/world/europe/turkey-istanbul-coronavirus.html?searchResultPosition=1281,"Every weekend, for over a month now, Istanbul has been under a strict curfew because of the coronavirus. No one is allowed out, not for exercise or groceries, and the police impose fines. Sometimes, like last weekend and next, the street-emptying lockdown stretches for four days to take in public holidays."
"After New Coronavirus Outbreaks, China Imposes Wuhan-Style Lockdown",https://www.nytimes.com/2020/05/21/world/asia/coronavirus-china-lockdown.html?searchResultPosition=1282,"In Shulan, a city in China’s northeast, the streets are eerily quiet, devoid of taxis and buses. Apartment complexes have been sealed off, confining residents inside. Teams of government workers go door to door rounding up sick people as part of what they call a “wartime” campaign."
"As Paris Tiptoes Toward Normalcy, Infections Are Sharply Down",https://www.nytimes.com/2020/05/20/world/europe/virus-paris-reopening.html?searchResultPosition=1285,"Coronavirus infections have dropped sharply in Paris following a strict two-month lockdown and a growing contact tracing effort, health officials say, and they have remained in check since the city began a halting return to life nearly two weeks ago."
Future of Shakespeare’s Globe Theater Is Threatened by Lockdown,https://www.nytimes.com/2020/05/20/world/europe/globe-theater-shakespeare-closing-coronavirus.html?searchResultPosition=1286,"Shakespeare’s Globe, a celebrated institution in London that showcases some of the world’s most recognizable stage plays, is in danger of permanently closing if it does not receive emergency funding to help make up for revenue it has lost during the coronavirus lockdown."
